{
  "schema_version": "0.1.0",
  "environment": {
    "id": "synthetic-explicit-write-environment",
    "platform": "TwinCAT",
    "connection_profile": "synthetic-profile"
  },
  "data_classification": "public_example",
  "sources": [
    {
      "id": "engineering-source",
      "type": "engineering_project",
      "description": "Synthetic writable binding exercised with an explicit runtime mode."
    }
  ],
  "bindings": [
    {
      "id": "explicit-write-request",
      "asset_id": "asset-1",
      "role": "command_request",
      "access": "read_write",
      "locator": {
        "kind": "ads_symbol",
        "value": "GVL_Demo.Request"
      },
      "datatype": "BOOL",
      "interaction": {
        "semantics": "request"
      },
      "status": "inferred",
      "confidence": 0.8,
      "source_refs": [
        "engineering-source"
      ]
    }
  ]
}
